<?xml version="1.0" encoding="UTF-8"?>
<?xml-stylesheet type="text/css" href="styles.css"?>
<BODY xmlns:xsi="http://www.w3.org/2001/XMLSchema-instance" xsi:noNamespaceSchemaLocation="xml3.xsd">
<HED>
<to>To: Me.</to>
<from>From: My Mind.</from>
</HED>
<SMTH>
<main>The main priorities to me.</main>
<cells>1. Eat food</cells>
<cells>2. Sing songs</cells>
<cells>3. Feel smell</cells>
<cells>4. Sleep well</cells>
<cells>5. Study good</cells>
</SMTH>
<epilogue>Thanks for your attention.</epilogue>
</BODY>

